{
  "format": "dsh-character",
  "formatVersion": 1,
  "id": "paper-star",
  "name": "纸片星星",
  "author": "dsh-coopanion contributors",
  "license": "MIT",
  "description": "序列帧示例角色。复制这个目录、替换图片和动画帧，就能制作自己的角色。",
  "canvas": {
    "width": 128,
    "height": 128
  },
  "renderer": {
    "type": "spritesheet",
    "image": "assets/star.png",
    "frameWidth": 128,
    "frameHeight": 128,
    "columns": 8,
    "rows": 1,
    "animations": {
      "idle": {
        "frames": [
          0,
          1,
          0,
          0
        ],
        "fps": 2
      },
      "walk": {
        "frames": [
          2,
          3
        ],
        "fps": 8
      },
      "happy": {
        "frames": [
          4,
          5
        ],
        "fps": 6
      },
      "sleeping": {
        "frames": [
          6
        ],
        "fps": 1
      },
      "error": {
        "frames": [
          7
        ],
        "fps": 1
      },
      "dragged": {
        "frames": [
          1
        ],
        "fps": 1
      },
      "poke": {
        "frames": [
          4,
          5
        ],
        "fps": 6,
        "loop": false
      }
    }
  }
}
