{
  "format": "dsh-character",
  "formatVersion": 1,
  "id": "my-portrait",
  "name": "我的立绘",
  "author": "dsh-coopanion contributors",
  "license": "MIT",
  "description": "立绘示例：替换 assets/portrait.png，并填写你自己的名称、作者与素材许可。",
  "canvas": {
    "width": 220,
    "height": 185
  },
  "renderer": {
    "type": "image",
    "image": "assets/portrait.png"
  }
}
